content,date,like,place,tags
".💙 구좌 ""제주모랑"" 💙사장님들이 손수 만든 수제소품들이 가득~좋은향이 가득한 구좌의 예쁜 소품샵이야　제주스럽고 아기자기한 소품도 많고다양한 향의 디퓨저 맛집으로 핫함👀❣감성충전하러 가기 딱이쟈나,,🎀@세화해변 근처니까 꼭 들러볼것!📌저장필수　　✅제주시 구좌읍 세화리 구좌로 48✅010-2779-2947✅@Jejumorang　　#제주모랑 #제주소품샵 #세화소품샵 #제주기념품 #제주기념품샵 #구좌읍소품샵 #제주선물가게 #제주소품샵투어 #제주기념품가게 #제주선물추천 #제주시소품샵 #제주여행선물 #제주여행선물추천 #제주여행 #제주핫플 #제주가볼만한곳 #제주도소품샵 #세화가볼만한곳 #제주맛집 #제주도맛집 #서귀포맛집 #제주카페 #서귀포카페",2021-08-18,"1,029",,"['#제주모랑', '#제주소품샵', '#세화소품샵', '#제주기념품', '#제주기념품샵', '#구좌읍소품샵', '#제주선물가게', '#제주소품샵투어', '#제주기념품가게', '#제주선물추천', '#제주시소품샵', '#제주여행선물', '#제주여행선물추천', '#제주여행', '#제주핫플', '#제주가볼만한곳', '#제주도소품샵', '#세화가볼만한곳', '#제주맛집', '#제주도맛집', '#서귀포맛집', '#제주카페', '#서귀포카페']"
제주공항과 애월사이에 위치한이춘옥원조고등어쌈밥👍우월한 맛!저희 이춘옥원조고등어쌈밥은가족이 드셔도부담없는가격!바다뷰 테라스! 데이트장소로도 딱😘다른곳에 가셔서 식사하시더라도맛집 성공! 기원합니다😃👍네이버 예약 / 포장시 10%할인👍𖤐 애월본점(수요일휴무)🚖위치:제주공항 10분 애월해안도로입구🕰시간:09:00~21:00𖤐 월정리점(수요일휴무)🚖위치: 제주시 구좌읍 월정중길 19-11🕰시간:09:00~21:00.💡제주도 원조 고등어쌈밥 맛집💡가족끼리 가도 부담없는 맛과 양과 자리💡공항에서 10분거리.#제주맛집#애월맛집#제주애월맛집#애월아침식사#제주공항밥집#제주애월식당#이호테우해변맛집,2021-08-18,0,,"['#제주맛집', '#애월맛집', '#제주애월맛집', '#애월아침식사', '#제주공항밥집', '#제주애월식당', '#이호테우해변맛집']"
"#제주맛집산도롱맨도롱----------🍜갈비국수 ""찐"" 맛집✔💕 큼직한 제주산 우대갈비토핑이 베이스로 !💕 탱글탱글한 면발과 담백한 육수 !💕 감칠맛이 훌륭한 돔베고기 !💕 잊지못할 맛의 신세계 새우초밥까지!.#제주도맛집.대기시간이 비교적 없는 아침타임!성산일출봉을 다녀온후 아침드시기 좋습니다😙.산도롱맨도롱영업시간:07:00~17:00✔매주 화요일은 휴무입니다✔문의 : 064-782-5105.#제주도고기국수맛집#성산맛집#섭지코지맛집#제주먹방투어#성산아침식사#제주도성산일출봉맛집#제주현지인추천",2021-08-17,0,,"['#제주맛집산도롱맨도롱----------🍜갈비국수', '#제주도맛집.대기시간이', '#제주도고기국수맛집', '#성산맛집', '#섭지코지맛집', '#제주먹방투어', '#성산아침식사', '#제주도성산일출봉맛집', '#제주현지인추천']"
.#연동 #모니카옛날통닭간판부터 맛집포스 작렬하는 찐맛집이젠 인생치킨이라고 말하기도 입아픔@칭구야 올때 포장해와@주소 : 제주 제주시 신대로10길 33..#제주맛집 #제주도맛집 #제주공항근처맛집 #제주시맛집 #애월맛집 #중문맛집 #제주공항맛집 #서귀포맛집 #산방산맛집 #신제주맛집 #제주시청맛집 #제주애월맛집 #월정리맛집 #제주여행 #제주핫플,2021-08-19,"1,103",,"['#연동', '#모니카옛날통닭간판부터', '#제주맛집', '#제주도맛집', '#제주공항근처맛집', '#제주시맛집', '#애월맛집', '#중문맛집', '#제주공항맛집', '#서귀포맛집', '#산방산맛집', '#신제주맛집', '#제주시청맛집', '#제주애월맛집', '#월정리맛집', '#제주여행', '#제주핫플']"
"_오늘의 블루보틀✨오픈시간 아주 조금 지나서 도착하니바로 입장하고 여유로움 :)블루보틀×우무가 협업한 커피푸딩과놀라플로트, 리에주 와플 주문.나올때 텀블러도 겟🤭",2021-08-18,"2,113",블루보틀 제주,[]
"#제주맛집산도롱맨도롱----------🍜제주도 ""찐"" 고기국수 맛집👏✅ 속이 꽉찬 새우초밥은 압도적 비쥬얼~!✅ 100% 사골육수가 일품인 백갈비국수~!✅ 알싸한 맛이 기가 막힌 홍갈비국수~!✅ 살이 실하게 오른 돔베고기~!..#제주도맛집.대기시간이 비교적 없는 아침타임!성산일출봉을 다녀온후 아침드시기 좋습니다😙.산도롱맨도롱영업시간:07:00~17:00✔매주 화요일은 휴무입니다✔문의 : 064-782-5105.#제주도고기국수맛집#성산맛집#섭지코지맛집#제주먹방투어#성산아침식사#제주도성산일출봉맛집#제주현지인추천",2021-08-18,0,,"['#제주맛집산도롱맨도롱----------🍜제주도', '#제주도맛집.대기시간이', '#제주도고기국수맛집', '#성산맛집', '#섭지코지맛집', '#제주먹방투어', '#성산아침식사', '#제주도성산일출봉맛집', '#제주현지인추천']"
(협찬)애월바다와 선셋🌅감성까지 더 한스페셜 카레맛집!😋다양한 카레와 토핑들로특별함을 UP!#사이카레@saicurry_aewolOPEN 10:00CLOSE 20:00🙅‍♀️연중무휴(임시휴무 인스타공지)🙅NO브레이크타임🙆재료소진시 조기마감될 수 있어요📞064)752.4279위치 - 제주시 애월읍 애월해안로 752 2층  (구엄리 509)#사이카레 #구엄리맛집 #애월맛집 #제주맛집 #제주도맛집#애월밥집 #제주공항근처맛집 #애월카페#애월가볼만한곳 #협재맛집 #한림맛집#제주도민맛집 #제주오션뷰 #제주시맛집#애월해안도로맛집 #한담맛집 #한담카페#협재카페 #한림카페 #제주카페#제주애월맛집 #애월핫플레이스 #제주핫플,2021-08-18,0,,"['#사이카레@saicurry_aewolOPEN', '#사이카레', '#구엄리맛집', '#애월맛집', '#제주맛집', '#제주도맛집', '#애월밥집', '#제주공항근처맛집', '#애월카페', '#애월가볼만한곳', '#협재맛집', '#한림맛집', '#제주도민맛집', '#제주오션뷰', '#제주시맛집', '#애월해안도로맛집', '#한담맛집', '#한담카페', '#협재카페', '#한림카페', '#제주카페', '#제주애월맛집', '#애월핫플레이스', '#제주핫플']"
광고)제주공항에서 진~짜가깝고 개별룸이 많아서 더 좋고맛있는 도민맛집으로유명한 '연동대게회타운'낮2시부터 ~ 라스트오더는 밤 12시까지개인룸에서 맘편하게 먹자!!🙊이야.. 살이 꽉 차있네소리가 절로나오는탱글 쫄깃한💦속살에⠀녹~찐한 내장까지증말 스릉흔다❤❤⠀밑반찬 구성도푸짐하니 다양하게즐길 수 있어 좋고!⠀살이꽉찬 대게&킹크랩 맛집👏⠀개별룸 형식으로걱정🙅 ♀없이 먹는'연동대게회타운'⠀<연동대게회타운>*제주 제주시 신대로 125*064-903-1889#제주맛집 #제주도맛집#제주공항근처맛집#제주골프 #제주도골프#제주여행 #제주도여행#제주 #제주도 #제주시맛집 #제주시 #제주도민맛집 #제주공항 #제주도공항,2021-08-18,0,,"['#제주맛집', '#제주도맛집', '#제주공항근처맛집', '#제주골프', '#제주도골프', '#제주여행', '#제주도여행', '#제주', '#제주도', '#제주시맛집', '#제주시', '#제주도민맛집', '#제주공항', '#제주도공항']"
서촌제 스시100 회전초밥🍣100가지 초밥이 모두 1700원! 🍣신선한 재료섬세한 손길하나하나 정성들여 만든100가지 초밥을종류에 상관없이같은 가격에 즐겨보세요!📍제주 제주시 은수길 65 📍영업시간  11:30~22:00(마지막 주문 21:30분)(브레이크 타임 15:00~17:00)📍문의전화 064 745 3796🍣#제주맛집 #제주시맛집 #제주시초밥 #제주도회전초밥 #제주초밥 #제주도초밥 #제주회전초밥 #제주초밥맛집 #제주시초밥맛집 #노형맛집 #제주노형동맛집,2021-08-18,481,,"['#제주맛집', '#제주시맛집', '#제주시초밥', '#제주도회전초밥', '#제주초밥', '#제주도초밥', '#제주회전초밥', '#제주초밥맛집', '#제주시초밥맛집', '#노형맛집', '#제주노형동맛집']"
애월 로드129성게크림파스타흑돼지 멘치카츠흑돼지 치즈돈까스흑돼지 고구마치즈돈까스흑돼지 수제돈까스해물야끼소바재료소진시 조기마감전메뉴 포장가능#애월맛집#제주맛집#애월읍맛집#애월항맛집#제주애월점심#애월맛집추천#제주애월맛집#애월점심추천#애월밥집#제주현지인맛집#제주도민추천맛집#제주도현지인맛집#도민맛집#제주혼밥#제주시맛집#제주도맛집#금능맛집#한림맛집#협재맛집#협재해수욕장맛집#곽지해수욕장맛집#더럭분교맛집#애월해안도로#제주서쪽맛집#애월데이트코스#새별오름#애월카페#제주데이트코스,2021-08-19,저 좋아요를 눌러보세,,"['#애월맛집', '#제주맛집', '#애월읍맛집', '#애월항맛집', '#제주애월점심', '#애월맛집추천', '#제주애월맛집', '#애월점심추천', '#애월밥집', '#제주현지인맛집', '#제주도민추천맛집', '#제주도현지인맛집', '#도민맛집', '#제주혼밥', '#제주시맛집', '#제주도맛집', '#금능맛집', '#한림맛집', '#협재맛집', '#협재해수욕장맛집', '#곽지해수욕장맛집', '#더럭분교맛집', '#애월해안도로', '#제주서쪽맛집', '#애월데이트코스', '#새별오름', '#애월카페', '#제주데이트코스']"
✅ 제주도 술자리문의 010-3975-3904 조은희실장💕✅ 제주도 모든유흥 ➡️ 은희실장 010-3975-3904💡24시간 상담가능💡☎️ 010-3975-3904 ☎️ 🔹 ️조은희실장☎️ 010-3975-3904 ☎️ 🔹 ️조은희실장..#제주맛집 #제주카페 #제주핫플레이스 #제주살이 #제주 #제주도 #노형맛집 #연동맛집 #연동술집 #노형술집 #제주술집 #제주도가볼만한곳 #제주도술집 #연동 #노형동 #제주도여행 #제주도맛집 #제주도룸 #제주여행 #제주핫플 #제주도가라오케 #제주도퍼블릭 #제주도유흥 #제주유흥 #제주퍼블릭 #제주도바 #제주도호빠 #제주도텐프로 #제주가라오케,2021-08-19,1,환상의 섬 Jeju Island,"['#제주맛집', '#제주카페', '#제주핫플레이스', '#제주살이', '#제주', '#제주도', '#노형맛집', '#연동맛집', '#연동술집', '#노형술집', '#제주술집', '#제주도가볼만한곳', '#제주도술집', '#연동', '#노형동', '#제주도여행', '#제주도맛집', '#제주도룸', '#제주여행', '#제주핫플', '#제주도가라오케', '#제주도퍼블릭', '#제주도유흥', '#제주유흥', '#제주퍼블릭', '#제주도바', '#제주도호빠', '#제주도텐프로', '#제주가라오케']"
이집 사장님의 인심이 엿보이는 한상이랄까요~ 2인상인데 정말 배 터질정도로 먹고 나왔어요🤣#제주예찬#제주도맛집 #제주맛집 #제주공항근처맛집 #제주시맛집 #제주도갈치조림 #제주예찬갈치조림 #제주갈치맛집 #제주갈치조림맛집 #제주도갈치조림맛집 #제주도갈치구이맛집 #제주도여행 #제주여행 #제주가볼만한곳 #제주도가볼만한곳,2021-08-19,저 좋아요를 눌러보세,,"['#제주예찬', '#제주도맛집', '#제주맛집', '#제주공항근처맛집', '#제주시맛집', '#제주도갈치조림', '#제주예찬갈치조림', '#제주갈치맛집', '#제주갈치조림맛집', '#제주도갈치조림맛집', '#제주도갈치구이맛집', '#제주도여행', '#제주여행', '#제주가볼만한곳', '#제주도가볼만한곳']"
"반박불가 고퀄 흑돼지로 기름칠 마구하고 싶을땐⁉️도민들 추천 흑돼지, 서귀포 #청춘괴기 🍖입안 침샘 다터지는 맛스럽+두툼쓰 비쥬얼 예술👍엄선한 고기라 잡내1도 없고 육즙도 장난없지~딱새우 서비스에 제철 미나리도 #무제한‼️다양한 쌈채소 가득한 샐러드바도 역시 #무료!컵와인까지 곁들이면 크으~🍷🤤고기덕후라면 이렇게 좋은곳은 못참지~@@ㄱㄱ✅ 소주주문시 새싹삼 제공 / 예약시 음료수 서비스✅ 네이버 예약시 5%할인👏[청춘괴기본점]🔸서귀포시 김정문화로 41번길 24-5🔸매일 11:30 ~ 23:00🔸문의 064 739 2272[청춘괴기 서귀포점]🔸서귀포시 동홍동로 27 107호🔸매일 11:30 ~ 23:00🔸문의 064 732 3777...",2021-08-19,3,,"['#청춘괴기', '#무제한‼️다양한', '#무료!컵와인까지']"
"곱들락은 130년 전통의 영국 황실 소금인 말돈소금을 사용합니다. 말돈소금은 영국 말돈지역에서 나오는 소금으로 바닷물을 끓여만드는 자염입니다. 구운고기에 곁들이기 최적화된 명품소금을 맛보여드리고 싶은 곱들락의 마음입니다. ..오늘도 그마음을 전하기위해 최선을 다하겠습니다~~(매일 낮12시부터 늦은밤11시까지, 마지막주문10시)..#곱들락 #곱들락탁희 #제주흑돼지맛집 #제주맛집 #제주도민맛집#제주공항맛집 #제주도흑돼지 #제주흑돼지#제주도맛집 #제주도흑돼지맛집 #함덕맛집 #제주공항근처맛집 #함덕흑돼지 #말돈소금",2021-08-19,1,,"['#곱들락', '#곱들락탁희', '#제주흑돼지맛집', '#제주맛집', '#제주도민맛집', '#제주공항맛집', '#제주도흑돼지', '#제주흑돼지', '#제주도맛집', '#제주도흑돼지맛집', '#함덕맛집', '#제주공항근처맛집', '#함덕흑돼지', '#말돈소금']"
"곱들락은 130년 전통의 영국 황실 소금인 말돈소금을 사용합니다. 말돈소금은 영국 말돈지역에서 나오는 소금으로 바닷물을 끓여만드는 자염입니다. 구운고기에 곁들이기 최적화된 명품소금을 맛보여드리고 싶은 곱들락의 마음입니다. ..오늘도 그마음을 전하기위해 최선을 다하겠습니다~~(매일 낮12시부터 늦은밤11시까지, 마지막주문10시)..#곱들락 #곱들락탁희 #제주흑돼지맛집 #제주맛집 #제주도민맛집#제주공항맛집 #제주도흑돼지 #제주흑돼지#제주도맛집 #제주도흑돼지맛집 #함덕맛집 #제주공항근처맛집 #함덕흑돼지 #말돈소금",2021-08-19,1,,"['#곱들락', '#곱들락탁희', '#제주흑돼지맛집', '#제주맛집', '#제주도민맛집', '#제주공항맛집', '#제주도흑돼지', '#제주흑돼지', '#제주도맛집', '#제주도흑돼지맛집', '#함덕맛집', '#제주공항근처맛집', '#함덕흑돼지', '#말돈소금']"
제주에서 난 재료로 신선하고 건강한 맛집 #제주분식주소:제주시 귀아랑길 23전화번호:064-726-2120....#제주공항근처맛집#제주연동맛집#제주여행#제주도민맛집#연동제주분식#제주맛집#제주도먹거리#제주시맛집#제주데이트#신제주맛집#제주맛집추천#애월해안도로,2021-08-19,저 좋아요를 눌러보세,제주도 Jeju Island,"['#제주분식주소:제주시', '#제주공항근처맛집', '#제주연동맛집', '#제주여행', '#제주도민맛집', '#연동제주분식', '#제주맛집', '#제주도먹거리', '#제주시맛집', '#제주데이트', '#신제주맛집', '#제주맛집추천', '#애월해안도로']"
인근 중문관광단지 맛집 중에서 줄 서서 먹는 곳이더라고요.여기 사장님이 제주 앞바다에서 낚은 은갈치와 각종 해산물로 만든 세트는 진짜 강추#색달식당중문본점#제주도갈치구이#제주통갈치조림#제주맛집#제주중문맛집#중문맛집색달식당#서귀포맛집#제주도맛집#제주갈치조림#제주도통갈치조림#제주도갈치조림맛집,2021-08-19,1,제주도 서귀포 동홍동,"['#색달식당중문본점', '#제주도갈치구이', '#제주통갈치조림', '#제주맛집', '#제주중문맛집', '#중문맛집색달식당', '#서귀포맛집', '#제주도맛집', '#제주갈치조림', '#제주도통갈치조림', '#제주도갈치조림맛집']"
Domaine Henri Gouges Nuits Saint Georges 1er cru Clos Des Porrets st georges 2007.뉘생조르주의 터줏대감 앙리 구주의 모노폴앙리 구주 특유의 벌키한 텍스처와 박하향🍃.#제주더스푼 #더스푼 #이탈리안 #제주맛집 #미슐랭 #와인 #와인스타그램 #내추럴와인 #チェジュグルメ#ミシュラン#ワイン#インスタ映え,2021-08-19,1,더스푼_Cafe & Kitchen,"['#제주더스푼', '#더스푼', '#이탈리안', '#제주맛집', '#미슐랭', '#와인', '#와인스타그램', '#내추럴와인', '#チェジュグルメ', '#ミシュラン', '#ワイン', '#インスタ映え']"
⠀#제주여행6일차⠀#협재홀라인라운지에서 커피 한잔 하고애월쪽으로 넘어가고있는 도중 핑크벽돌집이 눈에 띄어 자세히 보니 수제버거집이었다.차를 돌려 들어갔는데 현지인맛집인듯?백년초새우크림파스타와 흑돈떡갈비버거를 주문했다.핑크빛 파스타가 특별한 느낌💟 맛있게 먹고 향한 #곽지해수욕장사람 많은곳을 피해 셀카놀이 😆이후 숙소 체크인 #제주아마빌레마지막 숙소로 이 곳을 택한 이유가 있다. 오션뷰도 좋지만 숙소와 같이 운영하는 술집이 있기 때문이다.숙소 옆 계단으로 내려가면 #이자카야달밤에 식사겸 술 한잔 할 곳❤ ⠀⠀#오늘아님주의 #나홀로여행 #제주여행 #제주맛집 #신스버거  #제주숙소추천,2021-08-19,7,,"['#제주여행6일차⠀', '#협재홀라인라운지에서', '#곽지해수욕장사람', '#제주아마빌레마지막', '#이자카야달밤에', '#오늘아님주의', '#나홀로여행', '#제주여행', '#제주맛집', '#신스버거', '#제주숙소추천']"
"함덕해수욕장에서 차타고 1-2분거리 한번에 다섯가지를 먹을 수 있는 곳후식으로 우도땅콩아이스림까지 !!메뉴 : 안녕제주한상, 한라산을 품다, 뿔소라전복비빔밥, 뿔소라국수, 전복죽, 어린이한상위치 : 함덕 18길19영업시간 : 오전10시~오후7시20분함덕 맛집 안녕제주 많은 방문 부탁드립니다~ㅎㅎ#제주도 #제주도핫플 #제주맛집 #제주도맛집 #제주도현지인맛집 #제주현지인맛집 #제주현지인추천맛집 #함덕 #함덕맛집 #함덕해수욕장근처맛집 #함덕해변 #함덕해수욕장맛집 #함덕카페 #함덕소노벨리조트 #제주도여행 #제주도민맛집 #흑돼지 #우도땅콩아이스크림 #먹방 #함덕맛집탐방 #혼밥스타그램 #안녕제주 #함덕혼밥 #함덕해수욕장 #함덕현지인맛집 #함덕맛집추천 #제주함덕맛집 #함덕전복죽 #함덕어린이메뉴",2021-08-19,저 좋아요를 눌러보세,,"['#제주도', '#제주도핫플', '#제주맛집', '#제주도맛집', '#제주도현지인맛집', '#제주현지인맛집', '#제주현지인추천맛집', '#함덕', '#함덕맛집', '#함덕해수욕장근처맛집', '#함덕해변', '#함덕해수욕장맛집', '#함덕카페', '#함덕소노벨리조트', '#제주도여행', '#제주도민맛집', '#흑돼지', '#우도땅콩아이스크림', '#먹방', '#함덕맛집탐방', '#혼밥스타그램', '#안녕제주', '#함덕혼밥', '#함덕해수욕장', '#함덕현지인맛집', '#함덕맛집추천', '#제주함덕맛집', '#함덕전복죽', '#함덕어린이메뉴']"
"제주도를 대표하는 디저트 카페 ""섬타르""입니다!제주도의 멋진 뷰와 섬타르의 만남.★유정란을 사용하여 수제로 구워내고 있습니다★사장님이 오랜 연구 끝에 런칭한 제주산 수제 타르트 전문 브랜드 입니다★제주 공항에서 차로 10분거리★포토존이 있어서 고객분들이 거기서 꼭 촬영을 하고 가십니다상호명: 섬타르주소:제주 제주시 다랑곶1길 9연락처:064-744-4467주차유무: 가게앞 가게옆 뒷쪽에 공용주차장까지 있음#제주도카페 #제주카페 #제주공항근처카페 #제주시카페 #제주도선물 #제주선물 #제주도디저트 #제주디저트 #제주도여행 #제주여행 #제주도맛집#제주맛집 #제주공항카페 #제주도타르트 #제주타르트 #제주도 #제주#제주시맛집 #제주공항근처맛집 #제주도케이크",2021-08-19,1,,"['#제주도카페', '#제주카페', '#제주공항근처카페', '#제주시카페', '#제주도선물', '#제주선물', '#제주도디저트', '#제주디저트', '#제주도여행', '#제주여행', '#제주도맛집', '#제주맛집', '#제주공항카페', '#제주도타르트', '#제주타르트', '#제주도', '#제주', '#제주시맛집', '#제주공항근처맛집', '#제주도케이크']"
애월 로드129성게크림파스타흑돼지 멘치카츠흑돼지 치즈돈까스흑돼지 고구마치즈돈까스흑돼지 수제돈까스해물야끼소바재료소진시 조기마감전메뉴 포장가능#애월맛집#제주맛집#애월읍맛집#애월항맛집#제주애월점심#애월맛집추천#제주애월맛집#애월점심추천#애월밥집#제주현지인맛집#제주도민추천맛집#제주도현지인맛집#도민맛집#제주혼밥#제주시맛집#제주도맛집#금능맛집#한림맛집#협재맛집#협재해수욕장맛집#곽지해수욕장맛집#더럭분교맛집#애월해안도로#제주서쪽맛집#애월데이트코스#새별오름#애월카페#제주데이트코스,2021-08-19,저 좋아요를 눌러보세,,"['#애월맛집', '#제주맛집', '#애월읍맛집', '#애월항맛집', '#제주애월점심', '#애월맛집추천', '#제주애월맛집', '#애월점심추천', '#애월밥집', '#제주현지인맛집', '#제주도민추천맛집', '#제주도현지인맛집', '#도민맛집', '#제주혼밥', '#제주시맛집', '#제주도맛집', '#금능맛집', '#한림맛집', '#협재맛집', '#협재해수욕장맛집', '#곽지해수욕장맛집', '#더럭분교맛집', '#애월해안도로', '#제주서쪽맛집', '#애월데이트코스', '#새별오름', '#애월카페', '#제주데이트코스']"
말고기 먹고싶어서 찾아본 맛집! 영주말가든!비주얼부터 극에 달한 것 같은데!역시나 맛있음!최고임 정말~!!!#영주말가든#제주맛집#제주도맛집#제주공항근처맛집#제주공항맛집#제주도말고기맛집 #먹부림 #먹스타그램 #맞팔하자 #제주공항고기 #먹방사진 #맞팔신청,2021-08-19,138,영주말가든,"['#영주말가든', '#제주맛집', '#제주도맛집', '#제주공항근처맛집', '#제주공항맛집', '#제주도말고기맛집', '#먹부림', '#먹스타그램', '#맞팔하자', '#제주공항고기', '#먹방사진', '#맞팔신청']"
"2021.8.19#어깨동무오늘도 활짝 열려있습니다☺️📞 010-4417-8690🛵  단체주문, 포장, 배달🥘  즉석떡볶이, 김밥, 소풍도시락🏠  제주시 아란5길 8, 1층#제주#제주도#분식#제주여행#맛집#제주맛집#수제김밥#제주도시락#제주김밥#제주도민맛집#제주분식#아라동#아라동맛집#아라동김밥#배달#단체도시락#소풍도시락#피크닉도시락#제주대학병원맛집#제주떡볶이#제주김밥맛집#제주김밥단체#이벤트도시락#행사도시락#하객도시락#촬영도시락#떡볶이#김밥",2021-08-19,1,,"['#어깨동무오늘도', '#제주', '#제주도', '#분식', '#제주여행', '#맛집', '#제주맛집', '#수제김밥', '#제주도시락', '#제주김밥', '#제주도민맛집', '#제주분식', '#아라동', '#아라동맛집', '#아라동김밥', '#배달', '#단체도시락', '#소풍도시락', '#피크닉도시락', '#제주대학병원맛집', '#제주떡볶이', '#제주김밥맛집', '#제주김밥단체', '#이벤트도시락', '#행사도시락', '#하객도시락', '#촬영도시락', '#떡볶이', '#김밥']"
커플세트인데 양이 너무 많았다. 역시 #갈릭버터 는 실패없는 조합인듯😍............#먹스타그램 #맛스타그램 #맛집 #제주맛집 #서귀포맛집 #헬로우보일링크랩 #갈릭크랩 #갈릭랍스터 #갈릭새우 #맛집추천 #제주맛집추천,2021-08-19,7,,"['#갈릭버터', '#먹스타그램', '#맛스타그램', '#맛집', '#제주맛집', '#서귀포맛집', '#헬로우보일링크랩', '#갈릭크랩', '#갈릭랍스터', '#갈릭새우', '#맛집추천', '#제주맛집추천']"
