content,date,like,place,tags
.탁 트인 월정 바다 뷰를 볼 수 있는 야외 테라스와 옥상 빈백 정원 🐬곳곳에 있는 월정 바다를 배경으로 인생샷 포인트뿐만 아니라!달달한 수제 마카롱과 시그니처 음료까지!월정리 카페 콧수염에서 제주도 분위기를 만끽해보세요 ☀️🌊🌈제주시 구좌읍 해맞이해안로 406 카페콧수염070-4131-8880방문해주신 모든 분들께 감사드립니다매일 모든 메뉴 sold-out 되므로 선착순 판매합니다.#서귀포카페 #제주월정리 #공항근처맛집 #월정리 #구좌읍 #제주월정리카페 #제주도기념품 #제주동쪽카페 #월정리해수욕장 #월정리카페콧수염 #구좌읍맛집 #제주도맛집 #제주도마카롱 #제주도카페 #서귀포맛집 #월정리맛집 #성산일출봉맛집 #제주피크닉 #함덕카페 #제주맛집 #월정리카페 #제주도선물 #제주도여행 #제주시카페 #제주카페투어 #월정리콧수염 #애월맛집 #제주카페 #제주 #제주도,2021-08-19,저 좋아요를 눌러보세,,"['#서귀포카페', '#제주월정리', '#공항근처맛집', '#월정리', '#구좌읍', '#제주월정리카페', '#제주도기념품', '#제주동쪽카페', '#월정리해수욕장', '#월정리카페콧수염', '#구좌읍맛집', '#제주도맛집', '#제주도마카롱', '#제주도카페', '#서귀포맛집', '#월정리맛집', '#성산일출봉맛집', '#제주피크닉', '#함덕카페', '#제주맛집', '#월정리카페', '#제주도선물', '#제주도여행', '#제주시카페', '#제주카페투어', '#월정리콧수염', '#애월맛집', '#제주카페', '#제주', '#제주도']"
"안녕하세요 제주검정보리마씸입니다 😉갑자기 비가 많이 오네요 다들 우산은 챙기셨나요 ? 이런 날에는 수육에 막걸리 한 잔하면 얼마나 좋을까요모든 메뉴 포장 가능하니 집에서도 편안히 먹을 수 있어요 !!🤗거기다가 돼지고기는 수입산 ❌제주산이라는것 !! 알아두세용 그럼 오늘도 행복한 하루 보내세요 🥰저희 가게는 휴무, 브레이크 타임 없습니다아침 8시부터 밤 9시까지 영업합니다또, 포장 가능합니다 주소 : 하귀로 81 전화 : 064-746-4597#제주 #제주도 #하귀 #하귀맛집 #보리 #검정보리 #검정보리칼국수 #검정보리빔밥 #제주맛집 #제주도여행 #제주가볼만한곳 #제주시맛집 #애월맛집 #애월가볼만한곳 #애월맛집추천 #오늘뭐먹지 #보리김치",2021-08-19,0,,"['#제주', '#제주도', '#하귀', '#하귀맛집', '#보리', '#검정보리', '#검정보리칼국수', '#검정보리빔밥', '#제주맛집', '#제주도여행', '#제주가볼만한곳', '#제주시맛집', '#애월맛집', '#애월가볼만한곳', '#애월맛집추천', '#오늘뭐먹지', '#보리김치']"
제주 밤바다의 푸른 야(자)수,2021-08-19,106,Jungmun Beach,[]
"🔶우도올레보트고양이선장과 함께하는 신비한 동굴탐험 !서빈백사 ~ 검멀레동굴까지 !왕복 30분, 우도 내 최장거리코스 !.🔶 제주유리바닥보트.🔶 체험 스쿠버다이빙소규모로 진행하는 안전한 다이빙체험 ! 수영을 못해도 남녀노소 누구나 가능 !수중촬영 및 샤워용품까지 무료제공 #우도#제주#우도보트#올레보트#우도올레보트 #일상#소통#첫줄#여행#데일리 #첫손님#유리바닥보트#우도맛집 #제주맛집 #일상스타그램 #여행자  #여행에미치다 #여행스타그램 #선팔하면맞팔가요 #제주스쿠버다이빙#제주도여행 #우도여행코스 #우도다이브 #제주스쿠버#다이빙 #고양이선장 #우도가볼만한곳 #친추해요 #액티비티#감사합니다",2021-08-19,14,우도올레보트 udo olleh boat,"['#우도', '#제주', '#우도보트', '#올레보트', '#우도올레보트', '#일상', '#소통', '#첫줄', '#여행', '#데일리', '#첫손님', '#유리바닥보트', '#우도맛집', '#제주맛집', '#일상스타그램', '#여행자', '#여행에미치다', '#여행스타그램', '#선팔하면맞팔가요', '#제주스쿠버다이빙', '#제주도여행', '#우도여행코스', '#우도다이브', '#제주스쿠버', '#다이빙', '#고양이선장', '#우도가볼만한곳', '#친추해요', '#액티비티', '#감사합니다']"
".백향과에이드.목요일 시옽의 다과는밤양갱,여름이앙(레드향양갱),쌀호두파이,치즈케이크(오리지날)가 있습니다.밀크티도 준비되어 있어요. 제주는 오늘부터 사화적 거리두기 4단계가 시행됩니다. 모두 방역지침을 잘 지켜주시고 안전하시길 바랍니다.",2021-08-19,21,시옽,[]
"❤참여방법❤① @clean_n_media 팔로우② 본 피드에 '신청합니다' 댓글![댓글 작성시, 친구태그 부탁드려요]▶업체정보 : A1062▶업체위치 : 제주시 삼도이동▶모집기간 : 8월 19일 ~ 8월 25일▶당첨발표 : 8월 26일▶체험기간 : 8월 26일 ~ 9월 9일▶제공내역 : 2만원 식사권 (2인 기준)-------------------------------------★ 가이드라인 받은후 14일 이내에 체험후 후기링크 전송!★ 간단하게 신청해서 편하게 방문하는 체험단!★ 자주 이용한 체험단은 당첨확률 UP!UP!★ DM으로 이름과 연락처를 남겨주시면 빠른절차진행!★ 체험 후 후기글 업로드할 때 clean_n_media 태그!★ 필수 해시태그는 당첨자 발표와 함께 공지합니다! #체험단모집 #체험단 #체험단이벤트 #체험단모집중 #체험단신청 #체험단후기 #체험단모집이벤트 #인스타체험단 #인스타체험단모집 #인스타체험단이벤트 #인스타그램체험단 #인스타그램체험단모집 #클린앤미디어 #체험 #리뷰 #리뷰이벤트",2021-08-19,9,,"['#체험단모집', '#체험단', '#체험단이벤트', '#체험단모집중', '#체험단신청', '#체험단후기', '#체험단모집이벤트', '#인스타체험단', '#인스타체험단모집', '#인스타체험단이벤트', '#인스타그램체험단', '#인스타그램체험단모집', '#클린앤미디어', '#체험', '#리뷰', '#리뷰이벤트']"
"🔶우도올레보트고양이선장과 함께하는 신비한 동굴탐험 !서빈백사 ~ 검멀레동굴까지 !왕복 30분, 우도 내 최장거리코스 !.🔶 제주유리바닥보트.🔶 체험 스쿠버다이빙소규모로 진행하는 안전한 다이빙체험 ! 수영을 못해도 남녀노소 누구나 가능 !수중촬영 및 샤워용품까지 무료제공 #우도#제주#우도보트#올레보트#우도올레보트 #일상#소통#첫줄#여행#데일리 #첫손님#유리바닥보트#우도맛집 #제주맛집 #일상스타그램 #여행자  #여행에미치다 #여행스타그램 #선팔하면맞팔가요 #제주스쿠버다이빙#제주도여행 #우도여행코스 #우도다이브 #제주스쿠버#다이빙 #고양이선장 #우도가볼만한곳 #친추해요 #액티비티#감사합니다",2021-08-19,6,우도올레보트 udo olleh boat,"['#우도', '#제주', '#우도보트', '#올레보트', '#우도올레보트', '#일상', '#소통', '#첫줄', '#여행', '#데일리', '#첫손님', '#유리바닥보트', '#우도맛집', '#제주맛집', '#일상스타그램', '#여행자', '#여행에미치다', '#여행스타그램', '#선팔하면맞팔가요', '#제주스쿠버다이빙', '#제주도여행', '#우도여행코스', '#우도다이브', '#제주스쿠버', '#다이빙', '#고양이선장', '#우도가볼만한곳', '#친추해요', '#액티비티', '#감사합니다']"
"😋호스트분이 추천해주신 현지맛집 #우굼톳 베이스에 해산물이 가득 들어간 바릇국수와🦐전복, 전복내장, 성게가 들어간 전복장비빔밥🦪재료 너무 신선하고 다 처음 먹어보는 맛들로먹는 순간 바다가 한 입에 들어온다🌊💙📌 너무 맛있어서 부모님도 모시고 갈 예정✔️금,토,일,월만 오픈✔️수저도 뜨겁게 소독해주신걸 보니 더 신뢰가 가요",2021-08-19,21,우굼,['#우굼톳']
"🔶우도올레보트고양이선장과 함께하는 신비한 동굴탐험 !서빈백사 ~ 검멀레동굴까지 !왕복 30분, 우도 내 최장거리코스 !.🔶 제주유리바닥보트.🔶 체험 스쿠버다이빙소규모로 진행하는 안전한 다이빙체험 ! 수영을 못해도 남녀노소 누구나 가능 !수중촬영 및 샤워용품까지 무료제공 #우도#제주#우도보트#올레보트#우도올레보트 #일상#소통#첫줄#여행#데일리 #첫손님#유리바닥보트#우도맛집 #제주맛집 #일상스타그램 #여행자  #여행에미치다 #여행스타그램 #선팔하면맞팔가요 #제주스쿠버다이빙#제주도여행 #우도여행코스 #우도다이브 #제주스쿠버#다이빙 #고양이선장 #우도가볼만한곳 #친추해요 #액티비티#감사합니다",2021-08-19,8,우도올레보트 udo olleh boat,"['#우도', '#제주', '#우도보트', '#올레보트', '#우도올레보트', '#일상', '#소통', '#첫줄', '#여행', '#데일리', '#첫손님', '#유리바닥보트', '#우도맛집', '#제주맛집', '#일상스타그램', '#여행자', '#여행에미치다', '#여행스타그램', '#선팔하면맞팔가요', '#제주스쿠버다이빙', '#제주도여행', '#우도여행코스', '#우도다이브', '#제주스쿠버', '#다이빙', '#고양이선장', '#우도가볼만한곳', '#친추해요', '#액티비티', '#감사합니다']"
"🔶우도올레보트고양이선장과 함께하는 신비한 동굴탐험 !서빈백사 ~ 검멀레동굴까지 !왕복 30분, 우도 내 최장거리코스 !.🔶 제주유리바닥보트.🔶 체험 스쿠버다이빙소규모로 진행하는 안전한 다이빙체험 ! 수영을 못해도 남녀노소 누구나 가능 !수중촬영 및 샤워용품까지 무료제공 #우도#제주#우도보트#올레보트#우도올레보트 #일상#소통#첫줄#여행#데일리 #첫손님#유리바닥보트#우도맛집 #제주맛집 #일상스타그램 #여행자  #여행에미치다 #여행스타그램 #선팔하면맞팔가요 #제주스쿠버다이빙#제주도여행 #우도여행코스 #우도다이브 #제주스쿠버#다이빙 #고양이선장 #우도가볼만한곳 #친추해요 #액티비티#감사합니다",2021-08-19,7,우도올레보트 udo olleh boat,"['#우도', '#제주', '#우도보트', '#올레보트', '#우도올레보트', '#일상', '#소통', '#첫줄', '#여행', '#데일리', '#첫손님', '#유리바닥보트', '#우도맛집', '#제주맛집', '#일상스타그램', '#여행자', '#여행에미치다', '#여행스타그램', '#선팔하면맞팔가요', '#제주스쿠버다이빙', '#제주도여행', '#우도여행코스', '#우도다이브', '#제주스쿠버', '#다이빙', '#고양이선장', '#우도가볼만한곳', '#친추해요', '#액티비티', '#감사합니다']"
"협찬제주 대표 썬셋 맛집 ""랍스터빈""주소 : 제주시 애월읍 애월해안로 752전화 : 064-743-1979영업 : 오전11시~밤10시 연중무휴포장ㆍ배달 환영제주애월맛집💘 랍스터빈#애월맛집 #애월카페 #애월읍맛집 #제주애월맛집 #제주도맛집 #제주맛집 #제주도카페 #제주카페 #외도맛집 #하귀맛집 #한림맛집 #한림카페#애월해안도로맛집 #애월가볼만한곳 #제주공항맛집 #제주공항근처맛집 #제주 #제주도여행",2021-08-19,0,,"['#애월맛집', '#애월카페', '#애월읍맛집', '#제주애월맛집', '#제주도맛집', '#제주맛집', '#제주도카페', '#제주카페', '#외도맛집', '#하귀맛집', '#한림맛집', '#한림카페', '#애월해안도로맛집', '#애월가볼만한곳', '#제주공항맛집', '#제주공항근처맛집', '#제주', '#제주도여행']"
"🔶우도올레보트고양이선장과 함께하는 신비한 동굴탐험 !서빈백사 ~ 검멀레동굴까지 !왕복 30분, 우도 내 최장거리코스 !.🔶 제주유리바닥보트.🔶 체험 스쿠버다이빙소규모로 진행하는 안전한 다이빙체험 ! 수영을 못해도 남녀노소 누구나 가능 !수중촬영 및 샤워용품까지 무료제공 #우도#제주#우도보트#올레보트#우도올레보트 #일상#소통#첫줄#여행#데일리 #첫손님#유리바닥보트#우도맛집 #제주맛집 #일상스타그램 #여행자  #여행에미치다 #여행스타그램 #선팔하면맞팔가요 #제주스쿠버다이빙#제주도여행 #우도여행코스 #우도다이브 #제주스쿠버#다이빙 #고양이선장 #우도가볼만한곳 #친추해요 #액티비티#감사합니다",2021-08-19,7,우도올레보트 udo olleh boat,"['#우도', '#제주', '#우도보트', '#올레보트', '#우도올레보트', '#일상', '#소통', '#첫줄', '#여행', '#데일리', '#첫손님', '#유리바닥보트', '#우도맛집', '#제주맛집', '#일상스타그램', '#여행자', '#여행에미치다', '#여행스타그램', '#선팔하면맞팔가요', '#제주스쿠버다이빙', '#제주도여행', '#우도여행코스', '#우도다이브', '#제주스쿠버', '#다이빙', '#고양이선장', '#우도가볼만한곳', '#친추해요', '#액티비티', '#감사합니다']"
"🔶우도올레보트고양이선장과 함께하는 신비한 동굴탐험 !서빈백사 ~ 검멀레동굴까지 !왕복 30분, 우도 내 최장거리코스 !.🔶 제주유리바닥보트.🔶 체험 스쿠버다이빙소규모로 진행하는 안전한 다이빙체험 ! 수영을 못해도 남녀노소 누구나 가능 !수중촬영 및 샤워용품까지 무료제공 #우도#제주#우도보트#올레보트#우도올레보트 #일상#소통#첫줄#여행#데일리 #첫손님#유리바닥보트#우도맛집 #제주맛집 #일상스타그램 #여행자  #여행에미치다 #여행스타그램 #선팔하면맞팔가요 #제주스쿠버다이빙#제주도여행 #우도여행코스 #우도다이브 #제주스쿠버#다이빙 #고양이선장 #우도가볼만한곳 #친추해요 #액티비티#감사합니다",2021-08-19,6,우도올레보트 udo olleh boat,"['#우도', '#제주', '#우도보트', '#올레보트', '#우도올레보트', '#일상', '#소통', '#첫줄', '#여행', '#데일리', '#첫손님', '#유리바닥보트', '#우도맛집', '#제주맛집', '#일상스타그램', '#여행자', '#여행에미치다', '#여행스타그램', '#선팔하면맞팔가요', '#제주스쿠버다이빙', '#제주도여행', '#우도여행코스', '#우도다이브', '#제주스쿠버', '#다이빙', '#고양이선장', '#우도가볼만한곳', '#친추해요', '#액티비티', '#감사합니다']"
제주도에서만 즐길수있는 수제버거 관자스테이크버거 고단백 저칼로리 제주 버거요 미친선셋은 덤입니다,2021-08-19,0,,[]
"🔶우도올레보트고양이선장과 함께하는 신비한 동굴탐험 !서빈백사 ~ 검멀레동굴까지 !왕복 30분, 우도 내 최장거리코스 !.🔶 제주유리바닥보트.🔶 체험 스쿠버다이빙소규모로 진행하는 안전한 다이빙체험 ! 수영을 못해도 남녀노소 누구나 가능 !수중촬영 및 샤워용품까지 무료제공 #우도#제주#우도보트#올레보트#우도올레보트 #일상#소통#첫줄#여행#데일리 #첫손님#유리바닥보트#우도맛집 #제주맛집 #일상스타그램 #여행자  #여행에미치다 #여행스타그램 #선팔하면맞팔가요 #제주스쿠버다이빙#제주도여행 #우도여행코스 #우도다이브 #제주스쿠버#다이빙 #고양이선장 #우도가볼만한곳 #친추해요 #액티비티#감사합니다",2021-08-19,7,우도올레보트 udo olleh boat,"['#우도', '#제주', '#우도보트', '#올레보트', '#우도올레보트', '#일상', '#소통', '#첫줄', '#여행', '#데일리', '#첫손님', '#유리바닥보트', '#우도맛집', '#제주맛집', '#일상스타그램', '#여행자', '#여행에미치다', '#여행스타그램', '#선팔하면맞팔가요', '#제주스쿠버다이빙', '#제주도여행', '#우도여행코스', '#우도다이브', '#제주스쿠버', '#다이빙', '#고양이선장', '#우도가볼만한곳', '#친추해요', '#액티비티', '#감사합니다']"
"🔶우도올레보트고양이선장과 함께하는 신비한 동굴탐험 !서빈백사 ~ 검멀레동굴까지 !왕복 30분, 우도 내 최장거리코스 !.🔶 제주유리바닥보트.🔶 체험 스쿠버다이빙소규모로 진행하는 안전한 다이빙체험 ! 수영을 못해도 남녀노소 누구나 가능 !수중촬영 및 샤워용품까지 무료제공 #우도#제주#우도보트#올레보트#우도올레보트 #일상#소통#첫줄#여행#데일리 #첫손님#유리바닥보트#우도맛집 #제주맛집 #일상스타그램 #여행자  #여행에미치다 #여행스타그램 #선팔하면맞팔가요 #제주스쿠버다이빙#제주도여행 #우도여행코스 #우도다이브 #제주스쿠버#다이빙 #고양이선장 #우도가볼만한곳 #친추해요 #액티비티#감사합니다",2021-08-19,8,우도올레보트 udo olleh boat,"['#우도', '#제주', '#우도보트', '#올레보트', '#우도올레보트', '#일상', '#소통', '#첫줄', '#여행', '#데일리', '#첫손님', '#유리바닥보트', '#우도맛집', '#제주맛집', '#일상스타그램', '#여행자', '#여행에미치다', '#여행스타그램', '#선팔하면맞팔가요', '#제주스쿠버다이빙', '#제주도여행', '#우도여행코스', '#우도다이브', '#제주스쿠버', '#다이빙', '#고양이선장', '#우도가볼만한곳', '#친추해요', '#액티비티', '#감사합니다']"
💙수영 하면서 마시는 맥쥬는 꿀맛🍻#눈바디체크 유지하자용 💓 근데 막상 바프 끝나고나서 엄청 먹을지 알았는뎅 그것도 아니군 🤣생각보다 먹고싶은게 없댜..ㅋㅋㅋ아무튼 제주도 넘 좋다용 🥰#행복하게살자💐 #호캉스는사랑입니다,2021-08-19,56,환상의 섬 Jeju Island,"['#눈바디체크', '#행복하게살자💐', '#호캉스는사랑입니다']"
"⠀⠀♠ 좋아요 팔로워 늘리기 ♠⠀스스로 하는 인스타 성장이 힘이들진 않으신가요~~만약 그러시다면,바로스타에서 다양한 혜택과 최대 효과를 받아보세요~⠀자신이 직접 체계적인 프로세스를 통해 계정관리를 할 수 있으며, 원하는 마케팅 상품도 직접 주문하고 관리할 수 있습니다.⠀【 무료서비스 】무료로 상위노출. 방법과 인스타계정 상태를 분석 해드립니다. ※ 아이디를 남겨 놓으면 결과를 알려드립니다.⠀【 다양한효과 】♤  팔로워 / 좋아요 증가.♤  인기게시물 / 인지도 상승♤  계정 최적화 / 상위노출.♤  홍보효과 상승 / 효과적 소통♤  최고의 가성비 / 70%할인!⠀365일 빠른 서비스로 운영 중입니다.⠀○홈페이지○https://barostar.kr/⠀⠀⠀⠀⠀#맛집여행 #맛집그램#동래맛집 #순천맛집#부산맛집 #제주맛집#한식디저트 #한식레시피#울산맛집 #인천맛집#전주맛집 #파주맛집#천안맛집 #남포동맛집#중식요리 #중식레시피#부산대맛집 #돈가스맛집#부평맛집 #송도맛집",2021-08-19,112,,"['#맛집여행', '#맛집그램', '#동래맛집', '#순천맛집', '#부산맛집', '#제주맛집', '#한식디저트', '#한식레시피', '#울산맛집', '#인천맛집', '#전주맛집', '#파주맛집', '#천안맛집', '#남포동맛집', '#중식요리', '#중식레시피', '#부산대맛집', '#돈가스맛집', '#부평맛집', '#송도맛집']"
오늘 제주도 협재해수욕장 날씨 참 좋네요!,2021-08-18,56,에니스케리,[]
에니스케리에 신상 라탄백이 입고되었어요!,2021-08-17,52,에니스케리,[]
에니스케리 쇼룸&카페입니다. 친환경 소품이 가득한 쇼룸과 비양도를 품은 비치카페랍니다 :),2021-08-15,83,에니스케리,[]
"🔶우도올레보트고양이선장과 함께하는 신비한 동굴탐험 !서빈백사 ~ 검멀레동굴까지 !왕복 30분, 우도 내 최장거리코스 !.🔶 제주유리바닥보트.🔶 체험 스쿠버다이빙소규모로 진행하는 안전한 다이빙체험 ! 수영을 못해도 남녀노소 누구나 가능 !수중촬영 및 샤워용품까지 무료제공 #우도#제주#우도보트#올레보트#우도올레보트 #일상#소통#첫줄#여행#데일리 #첫손님#유리바닥보트#우도맛집 #제주맛집 #일상스타그램 #여행자  #여행에미치다 #여행스타그램 #선팔하면맞팔가요 #제주스쿠버다이빙#제주도여행 #우도여행코스 #우도다이브 #제주스쿠버#다이빙 #고양이선장 #우도가볼만한곳 #친추해요 #액티비티#감사합니다",2021-08-19,10,우도올레보트 udo olleh boat,"['#우도', '#제주', '#우도보트', '#올레보트', '#우도올레보트', '#일상', '#소통', '#첫줄', '#여행', '#데일리', '#첫손님', '#유리바닥보트', '#우도맛집', '#제주맛집', '#일상스타그램', '#여행자', '#여행에미치다', '#여행스타그램', '#선팔하면맞팔가요', '#제주스쿠버다이빙', '#제주도여행', '#우도여행코스', '#우도다이브', '#제주스쿠버', '#다이빙', '#고양이선장', '#우도가볼만한곳', '#친추해요', '#액티비티', '#감사합니다']"
제주도에 이런 클럽이 있다니 처음 알았어요#픽미펍클럽#제주도클럽#제주클럽#월정리클럽#제주도술집#월정리술집#제주도술집#제주도펍#제주펍#월정리펍#월정리맛집#제주월정리맛집#제주도맛집#제주맛집#제주도술집픽미펍클럽,2021-08-19,229,,"['#픽미펍클럽', '#제주도클럽', '#제주클럽', '#월정리클럽', '#제주도술집', '#월정리술집', '#제주도술집', '#제주도펍', '#제주펍', '#월정리펍', '#월정리맛집', '#제주월정리맛집', '#제주도맛집', '#제주맛집', '#제주도술집픽미펍클럽']"
맛좋고뷰좋고👍싸장님 제주명소 소개해주셨는데 저희 뚜벅이에여🥲,2021-08-19,1,고내포구,[]
.빵수니 빵도리들을 위한 <제주 빵지순례 모음! >맛있고 가볼만한 빵집들을 모아봤어 :)저장 해뒀다가 꼭 한번 들러보기!함께 하고픈 빵 러버들 소환@..#제주맛집 #제주도맛집 #제주공항근처맛집 #제주시맛집 #애월맛집 #중문맛집 #제주공항맛집 #서귀포맛집 #산방산맛집 #신제주맛집 #제주시청맛집 #제주애월맛집 #월정리맛집 #제주여행 #제주핫플,2021-08-19,208,,"['#제주맛집', '#제주도맛집', '#제주공항근처맛집', '#제주시맛집', '#애월맛집', '#중문맛집', '#제주공항맛집', '#서귀포맛집', '#산방산맛집', '#신제주맛집', '#제주시청맛집', '#제주애월맛집', '#월정리맛집', '#제주여행', '#제주핫플']"
.빵수니 빵도리들을 위한 <제주 빵지순례 모음! >맛있고 가볼만한 빵집들을 모아봤어 :)저장 해뒀다가 꼭 한번 들러보기!함께 하고픈 빵 러버들 소환@..#제주맛집 #제주도맛집 #제주공항근처맛집 #제주시맛집 #애월맛집 #중문맛집 #제주공항맛집 #서귀포맛집 #산방산맛집 #신제주맛집 #제주시청맛집 #제주애월맛집 #월정리맛집 #제주여행 #제주핫플,2021-08-19,"1,023",,"['#제주맛집', '#제주도맛집', '#제주공항근처맛집', '#제주시맛집', '#애월맛집', '#중문맛집', '#제주공항맛집', '#서귀포맛집', '#산방산맛집', '#신제주맛집', '#제주시청맛집', '#제주애월맛집', '#월정리맛집', '#제주여행', '#제주핫플']"
.빵수니 빵도리들을 위한 <제주 빵지순례 모음! >맛있고 가볼만한 빵집들을 모아봤어 :)저장 해뒀다가 꼭 한번 들러보기!함께 하고픈 빵 러버들 소환@..#제주맛집 #제주도맛집 #제주공항근처맛집 #제주시맛집 #애월맛집 #중문맛집 #제주공항맛집 #서귀포맛집 #산방산맛집 #신제주맛집 #제주시청맛집 #제주애월맛집 #월정리맛집 #제주여행 #제주핫플,2021-08-19,972,,"['#제주맛집', '#제주도맛집', '#제주공항근처맛집', '#제주시맛집', '#애월맛집', '#중문맛집', '#제주공항맛집', '#서귀포맛집', '#산방산맛집', '#신제주맛집', '#제주시청맛집', '#제주애월맛집', '#월정리맛집', '#제주여행', '#제주핫플']"
제주공항 근처라 떠나기 전에 들렸던 곳인데 기대 이상의 고기국수 ㄷㄷ#먹돌주소: 제주 제주시 월성로 26...#제주도맛집 #제주맛집 #제주공항근처맛집 #제주도여행 #제주도고기국수 #제주도고기국수클라스#제주국수 #제주여행 #제주가볼만한곳 #제주도가볼만한곳 #제주도먹방 #제주도 #제주 #제주도카페 #제주카페,2021-08-19,215,,"['#먹돌주소:', '#제주도맛집', '#제주맛집', '#제주공항근처맛집', '#제주도여행', '#제주도고기국수', '#제주도고기국수클라스', '#제주국수', '#제주여행', '#제주가볼만한곳', '#제주도가볼만한곳', '#제주도먹방', '#제주도', '#제주', '#제주도카페', '#제주카페']"
".제주 물회전문점 바당한그릇🍣바다가 보이는 분위기 좋은 곳에 있어요오늘도 신선한 재료로 다양한 해산물요리준비했습니다. 맛있는 식사 하시러 오세요!.🔹제주 애월읍 애월해안로 552-3🔹OPEN 오전 11시 ~ 오후 8시 까지(Break time 오후 2시반 ~ 5시)모든 메뉴 포장 및 배달가능, 재료소진시 조기마감 됩니다🙏...#제주맛집 #바당한그릇 #애월 #애월초밥 #제주물회",2021-08-19,234,,"['#제주맛집', '#바당한그릇', '#애월', '#애월초밥', '#제주물회']"
